{
  "id": "STY-20260723-124819-ECHO",
  "title": "The Echo-Sprite’s Trial",
  "publishedAt": "2026-07-23",
  "summary": "Shodo faces Vex through three dangerous trials and discovers that calm, connection, and kindness can be stronger than fear.",
  "purpose": "True strength means staying kind and courageous when we are afraid.",
  "heroes": ["Shodo"],
  "villains": ["Vex"],
  "tags": ["courage", "kindness", "memories", "mirror-magic"],
  "readingMinutes": 6,
  "accent": "plum",
  "symbol": "🪞",
  "body": [
    "The sun was setting behind the Ancient Tree, casting long, golden shadows across the forest floor. Shodo knew it was time for her nightly check. She pulled the brass key from her pocket, and as it touched the tiny, knotted hole in the tree, the bark shimmered like liquid starlight. With a soft whoosh, she slipped through the bridge and into the Fairy Kingdom.",
    "But tonight, the kingdom was held in a heavy, velvet-purple silence. The Bubble Lake, usually dancing with rainbows, was as flat and cold as a sheet of ice. Standing at its center, hovering above the water, was Vex, the Echo-Sprite. He wasn't a fairy, but a jagged, shifting cloud of broken mirror shards, and he was trapping the memories of the entire forest inside the depths of the lake.",
    "“You're late, Bridge-Child,” Vex hissed, his voice echoing in a thousand different tones. “I am tired of this kingdom's joy. I will take their memories, and then, I will finally have a home made of everyone’s dreams.”",
    "Moment 1: The Mirror Trap",
    "Vex swiped his hand, and the ground beneath Shodo dissolved into a shimmering bridge of thin air. As she stood there, paralyzed, a dark version of Shodo emerged from the air, mimicking her every movement with a mocking, cruel smile. “Why struggle?” the shadow-Shodo whispered. “You don't belong here. You're just a girl who found a hole in a tree.” The bridge began to spiderweb with cracks under her feet. Shodo felt the vertigo pull at her, but she didn't look down. She closed her eyes, remembering her mother’s voice teaching her that the forest only holds you if you trust it. She took a slow, deep breath, visualizing her own heartbeat, and the shadow-Shodo flickered and vanished, unable to match Shodo's quiet, steady calm.",
    "Moment 2: The Stolen Voice",
    "Vex didn't wait. He lunged, a blur of silver and shadow, and before Shodo could even blink, he reached into her and snatched her voice away. Shodo tried to scream for Queen Bubble, but her throat was filled with nothing but cold air. Only soft, muted bubbles drifted from her lips, popping silently before they reached the ground. The world began to lose its color—the trees turned gray, the grass went dull, and the sky bleached to a terrifying white. Shodo was terrified, but she remembered that in this world, truth didn't need a sound. She knelt and pressed her palms deep into the mossy roots of the Ancient Tree. She pushed all the love she felt for the fairies—every laugh, every lesson, every happy moment—down into the earth. It wasn't a shout, it was a pulse. The ground began to glow with a warm, golden rhythm that vibrated through the air, shaking off the silence Vex had tried to impose.",
    "Moment 3: The Memory Fracture",
    "Seeing his control slipping, Vex went into a frenzy. He shattered the mirror-dimension above him, and thousands of glowing shards—each one a stolen memory—rained down like jagged hail. A memory of a child’s first birthday party; a memory of a warm hug; a memory of a sunset. If they hit the cold lake, they would shatter into forever-nothingness. Shodo threw herself into the air, dancing through the falling chaos. She caught one shard, then two, her hands growing numb with the cold of Vex’s magic. She didn't think about the pain; she thought about what each memory meant. She pulled them to her chest, holding them as if they were her own.",
    "As she landed back on the shore, the light from the shards soaked into her, making her glow with the warmth of a hundred stolen joys. Vex stopped his assault, his mirror-body trembling. He stared at the girl who was covered in the very memories he had tried to hoard.",
    "“Why?” Vex rasped, his voice finally losing its echo. “They are only fragments. They belong to me now.”",
    "Shodo, unable to speak, took a single shard—a glowing memory of a fairy sharing a flower—and held it up so Vex could see his own reflection. In the shard, he didn't see a monster. He saw a small, lost sprite, made of the same light he had been stealing. The weight of his loneliness finally hit him. He saw that he had been trying to build a home by taking away everyone else’s, and it had only left him colder than before.",
    "Slowly, Vex began to change. The sharp, jagged mirrors smoothed out into soft, glowing light. He let out a long, shuddering breath, and the lake began to ripple again, returning the stolen memories to the air like fireflies.",
    "Shodo sat by the lake for a long time, watching Vex fade from a threatening shadow into a quiet, remorseful spark. She learned that true strength isn't about how loud we can shout or how hard we can fight; it’s about the courage to stay kind when we are afraid. By protecting what was precious to others, Shodo didn't just save the kingdom—she gave Vex a chance to find the light inside himself again. She showed him that he didn't need to be a thief to be part of the world; he just needed to be a friend.",
    "And so, the forest returned to its vibrant, humming self. Vex remained, not as a villain, but as a quiet observer, learning from Shodo how to be a part of the forest instead of a shadow within it."
  ]
}
