{
  "id": "STY-SHODO-2026-08-05-001",
  "title": "Shodo and the Echoing Whispers: The Shadow Storm Adventure",
  "publishedAt": "2026-08-05",
  "summary": "Shodo helps Vex master his booming voice before they face Shadow-Queen Morga together in a battle for the Forest Bridge.",
  "purpose": "Listening, courage, and loyal friendship can help us discover our true strength.",
  "heroes": [
    "Shodo",
    "Vex"
  ],
  "villains": [
    "Shadow-Queen Morga"
  ],
  "tags": [
    "bravery",
    "listening",
    "friendship",
    "forest-magic"
  ],
  "readingMinutes": 6,
  "accent": "moon",
  "symbol": "🌳",
  "body": [
    "The forest was usually a happy place, full of singing butterflies and golden light. But today, a dark and cold shadow hung over everything. Vex, our friend who used to be a grumpy Echo-Sprite, was very sad. Every time he tried to say ‘hello,’ his voice turned into a loud, scary ROAR! It was like a big, booming drum that made the flowers wiggle and the butterflies fly away.",
    "Shodo, the brave girl who protects the Forest Bridge, hurried to help. She saw Vex hiding behind a tree, shaking. She remembered how he used to be her favorite tree to lean on, her oldest friend in the forest, and how a jealous fairy had cursed him to become the lonely reflection in the lake. ‘I don't mean to be loud!’ he cried. ‘It hurts my throat! Everyone thinks I'm a monster again!’",
    "Shodo knew they had to be very brave to fix this. She told Vex he had to pass three special challenges to get his gentle voice back, and that he was becoming more than an Echo-Sprite—he was becoming a guardian of the forest.",
    "Challenge 1: The Frowning Flower's Lesson",
    "Shodo took Vex to the Meadow of Melodies, where a giant, magical flower lived. This flower loved peace, but it frowned and turned blue if it heard even the smallest whisper. Vex had to walk past it without making a single sound. He tried his best, but his heavy boots made a thud-thud-thud on the grass. The flower began to frown! Vex got frustrated and wanted to stomp, but Shodo whispered, ‘Think of yourself as light as the wind, Vex. You have the stillness of a tree inside you.’ Vex closed his eyes, felt the ancient strength of his old tree-self, and stepped so softly he barely touched the ground. The flower turned back to its bright, happy pink!",
    "Challenge 2: The Cave of a Thousand Echoes",
    "Next, they climbed to the top of the mountain to the Cave of Echoes. Inside, the walls were made of crystal that caught every sound. Vex had to sit in the pitch-black center of the cave for a whole day without saying a word. It was scary! His mind played tricks on him, whispering mean things. He almost started to argue back, but then he remembered Shodo's advice to listen. He sat perfectly still and listened to the drip-drop of water, the wind outside, and his own steady heart. By staying quiet, he heard the secret, happy song the cave had been singing all along. He realized that silence was a friend that helped him know who he really was.",
    "Challenge 3: The Dance of the Wind-Sprites",
    "Finally, they reached the peak, where the mean Wind-Sprites were throwing a tantrum. They were so loud and fast! Shodo tried to calm them, but they just swirled faster. ‘Use your voice, Vex!’ Shodo called. Vex was scared to make a sound, but he remembered the soft, earthy song from the cave. He opened his mouth and hummed—not a roar, but a deep, smooth, happy note that sounded like a cello. It was so calming that the Wind-Sprites stopped their angry spinning. They began to dance in slow circles around Vex, finally at peace. Vex smiled, realizing his voice wasn't just for roaring—it could be a song of friendship.",
    "The Villain's Secret",
    "Under the very spot where the Wind-Sprites danced, Vex found a strange, glowing rock that pulsed with a dark light. It was a Boom-Stone, a magical anchor someone had buried to make his voice boom like a drum. Vex realized someone wanted him to be a monster. He dug it up and put it in a lead box, and the heavy feeling in his throat vanished instantly.",
    "The Shadow Queen Returns",
    "But just as they cheered, the sky turned a dark, bruised purple. An icy cold wind knocked the leaves off the trees. Standing on the bridge was Shadow-Queen Morga! Her cape was made of swirling storm clouds, and her eyes burned like cold embers.",
    "‘So, you found my little trick,’ Morga hissed, her voice sounding like ice cubes rattling in a glass. She waved a long, dark finger, and the beautiful forest turned gray and sad. The butterflies turned into prickly, sharp bits of black coal, and the Forest Bridge—the only way home—began to shake and crack!",
    "‘Choose, Shodo!’ Morga laughed, pointing at the bridge. ‘Will you save your monster friend, or will you run home to safety while I break your bridge forever?’",
    "Shodo looked at Vex, who was trembling with fear, and then at the crumbling bridge. She knew she couldn't run. She grabbed Vex's hand, stood tall, and faced the Shadow Queen. ‘I'm not running, Morga!’ Shodo shouted. ‘You can't break our friendship!’",
    "The Battle of the Forest Spirit",
    "Morga sent a wave of dark energy crashing toward them. Vex didn't cower. As the shadows lunged, Vex felt the ancient, deep-rooted strength of the magnificent tree he once was awaken within him. He didn't just fight with his sprite-light; he reached deep into the earth, pulling up the power of the forest floor. Roots, thick and strong as iron, burst from the ground, creating a protective shield around Shodo and himself, blocking Morga's blast!",
    "Morga gasped, her dark eyes wide. ‘That magic is forgotten! You are just an echo!’",
    "‘I am the forest!’ Vex roared, his voice now a harmonious blend of his deep, gentle bass and the rustling leaves of his past. He pushed his hands forward, and the ground pulsed with golden energy. He turned the jagged obsidian shards back into beautiful, singing butterflies, swarming around Morga until she was trapped in a whirlwind of light.",
    "Shodo watched, amazed, as Vex fought not with anger, but with the calm, steady love of the tree she had leaned on for years. With one final, powerful hum, Vex released a wave of pure forest energy that sent Morga spinning back into the dark shadows.",
    "The bridge stopped shaking and began to repair itself, glowing with new, healthy vines. Morga vanished with a shriek of rage, promising she would return. Vex stood there, breathless, still glowing with the warm, golden light of his ancient tree-self. He turned to Shodo and smiled, a truly happy, gentle smile. ‘I'm not just a reflection, Shodo,’ he said softly. ‘I'm the forest's guardian, and I'm your friend, forever.’",
    "Shodo hugged her friend, knowing the storm had passed for now, and that together, they could face anything the shadows dared to bring."
  ]
}
