{
  "id": "STY-20260723-122915-VEX1",
  "title": "The Whisper-Shadow in the Bubble Lake",
  "publishedAt": "2026-07-23",
  "summary": "When Vex steals Shodo's key and the kingdom's memories, Shodo discovers that listening and sharing a joyful memory can reach someone who feels forgotten.",
  "purpose": "Empathy and listening can turn loneliness into understanding.",
  "heroes": ["Shodo"],
  "villains": ["Vex"],
  "tags": ["empathy", "memories", "listening", "mirror-magic"],
  "readingMinutes": 3,
  "accent": "moon",
  "symbol": "🫧",
  "body": [
    "Shodo stepped into the Fairy Kingdom, but instead of the usual sparkling welcome, the sky was a deep, velvet purple. Queen Bubble was frantic. “Shodo, something is wrong with the lake! It’s not reflecting our faces anymore; it’s showing... other places.”",
    "Shodo peered into the water. Instead of her own reflection, she saw her own bedroom in the human world—but everything was floating in mid-air. Then, the reflection shifted to a dark, metallic fortress she had never seen before.",
    "Suddenly, a voice rippled out from the water. It wasn’t a fairy; it was an Echo-Sprite named Vex, who lived in the cracks of the mirror-dimension. Vex wasn’t interested in jars; he was a thief of moments. He was trapping memories inside the lake, making the fairies forget how to make bubbles and the humans forget how to dream.",
    "“If I can't have a home,” Vex whispered, his voice sounding like a thousand echoes, “then nobody gets to keep their memories.”",
    "He reached out from the surface of the lake, his fingers like liquid shadow, and grabbed Shodo’s golden key. With a flash, the key vanished into the water! Without it, Shodo couldn't open the tree-portal back to her world. She was trapped—and the more she looked into the lake, the more she started to forget what her favorite toy looked like, and even what color her bedroom walls were.",
    "Shodo’s heart raced. She realized that Vex was terrified of being forgotten, so he was trying to make everyone else lose their memories so he wouldn't be alone. She didn't fight him with force; she fought him with connection.",
    "She sat by the edge of the lake and began to tell the loudest, happiest story she could remember—a story about her mummy teaching her to ride a bike. She spoke it clearly, loud enough for the lake to hear. As the story spilled out, the water turned from dark purple to a clear, shimmering blue. The shadows began to dissolve, not because they were defeated, but because they were finally heard.",
    "Vex recoiled, stunned. He had never had someone tell him a story before. The stolen key floated back to the surface.",
    "Shodo discovered that sometimes, people act out or behave in ways that seem “bad” because they feel invisible or lonely. Instead of fighting fire with fire, she used empathy. When we listen to others and share our own stories, we can turn a cold, lonely moment into a bridge of understanding."
  ]
}
